### ISSUE TITLE
Error when decoding Diameter AVP containing ByteBuf values on TCP protocol

### ISSUE THREAD

**Issue by marcomassaroni** [mobius-software-ltd/corsac-diameter#112]
Hello, 
I tried to send from a GMLC AS the message PRovide Location Request using TCP. Once received from the simulated MME, it sends back the Provide Location Answer. The AVP that contain simple data types (integer e.g.) are ok, but the AVP containing hex streams, e.g. ECGI when decoded from NETTY generate an ERROR on the GMLC side. If I use SCTP all is ok and no errors are generated. The point is that I should use TCP.
Please could you check why TCP is not fully working on this Diameter stack?
Thanls in advance
MArco

```
Frame 25: 556 bytes on wire (4448 bits), 556 bytes captured (4448 bits)
Linux cooked capture v1
Internet Protocol Version 4, Src: 172.28.0.2, Dst: 172.28.0.3
Transmission Control Protocol, Src Port: 4869, Dst Port: 3869, Seq: 1, Ack: 361, Len: 488
Diameter Protocol
    Version: 0x01
    Length: 488
    Flags: 0x40, Proxyable
    Command Code: 8388620 3GPP-Provide-Location
    ApplicationId: 3GPP SLg (16777255)
    Hop-by-Hop Identifier: 0xaaffac89
    End-to-End Identifier: 0xaaffac89
    [Request In: 23]
    [Response Time: 0.106042000 seconds]
    AVP: Session-Id(263) l=80 f=-M- val=client1_slg.mobius-software.com;0;1;bd274600-2b49-11f0-9b90-ac1c000336da
    AVP: Vendor-Specific-Application-Id(260) l=32 f=-M-
    AVP: Result-Code(268) l=12 f=-M- val=DIAMETER_SUCCESS (2001)
    AVP: Auth-Session-State(277) l=12 f=-M- val=NO_STATE_MAINTAINED (1)
    AVP: Origin-Host(264) l=39 f=-M- val=server1_slg.mobius-software.com
    AVP: Origin-Realm(296) l=27 f=-M- val=mobius-software.com
    AVP: Location-Estimate(1242) l=74 f=VM- vnd=TGPP val=353333333335633262303333333832373331333532653333333732323230353734353331…
    AVP: Age-Of-Location-Estimate(2514) l=16 f=VM- vnd=TGPP val=37
    AVP: ECGI(2517) l=20 f=VM- vnd=TGPP val=3237363234373131
        AVP Code: 2517 ECGI
        AVP Flags: 0xc0, Vendor-Specific: Set, Mandatory: Set
        AVP Length: 20
        AVP Vendor Id: 3GPP (10415)
        ECGI: 3237363234373131
    AVP: Serving-Node(2401) l=152 f=VM- vnd=TGPP


SlgServerListener class in the diameter module on the MME simulated side, sending ProvideLocationAnswer:
------------------
	@Override
	public void onInitialRequest(SlgRequest request, ServerAuthSessionStateless<SlgAnswer> session, String linkID,AsyncCallback callback) {
		try{
			if(request instanceof ProvideLocationRequest) {
				ProvideLocationRequest provideLocationRequest =(ProvideLocationRequest)request;
				ProvideLocationAnswer provideLocationAnswer = provider.getMessageFactory().createProvideLocationAnswer(provideLocationRequest, provideLocationRequest.getHopByHopIdentifier(), provideLocationRequest.getEndToEndIdentifier(), ResultCodes.DIAMETER_SUCCESS);

				....
				
				// set ecgi
				String ecgi = "27624711";
				byte[] bytesEcgi = ecgi.getBytes(StandardCharsets.UTF_8);
				ByteBuf bufEcgi = Unpooled.wrappedBuffer(bytesEcgi);

				
ProvideLocationAnswerImpl class  in the diameter module on the GMLC side, receiving ProvideLocationAnswer
------------------------
...
public class ProvideLocationAnswerImpl extends SlgAnswerImpl implements ProvideLocationAnswer
{
	@Override
	public ByteBuf getECGI()
	{
		if(ecgi == null)
			return null;
		
		return ecgi.getValue(); <-----
	}


DiameterOctetStringImpl class  in the diameter module on the GMLC side, receiving ProvideLocationAnswer
------------------------
public class DiameterOctetStringImpl extends DiameterAvpImpl implements DiameterOctetString
{
...
	public ByteBuf getValue() 
	{
		if(value==null)
			return Unpooled.EMPTY_BUFFER;
		
		return Unpooled.wrappedBuffer(value); <----error here
	}


ERROR on the GMLC side
---------------------------
payload=EVENT_REQUEST, headers={id=b8d8de2d-7c78-c33e-e271-44185ad432e6, timestamp=1746625841269}], messageHeaders={id=b8d8de2d-7c78-c33e-e271-44185ad432e6, timestamp=1746625841269}, extendedState=DefaultExtendedState [variables={REQUEST_DATA=it.tykelab.gmlc.diameter.slg.model.ProvideLocationData@3c92c0e9[lcsPriority=0,msisdn=333910420708,dumpPcap=true,transactionId=PL_333910420708_20250507155040150]}], transition=null, stateMachine=TRANSACTION_TIMEOUT TRANSACTION_FAILED TRANSACTION_SUCCESS TRANSACTION_SENT EMPTY  / TRANSACTION_SENT / uuid=40393951-193b-4324-af75-4757f0e7e489 / id=PL_333910420708_20250507155040150, source=ObjectState [getIds()=[EMPTY], getClass()=class org.springframework.statemachine.state.ObjectState, hashCode()=1554953570, toString()=AbstractState [id=EMPTY, pseudoState=org.springframework.statemachine.state.DefaultPseudoState@7b03b388, deferred=[], entryActions=[], exitActions=[], stateActions=[], regions=[], submachine=null]], target=ObjectState [getIds()=[TRANSACTION_SENT], getClass()=class org.springframework.statemachine.state.ObjectState, hashCode()=1264200172, toString()=AbstractState [id=TRANSACTION_SENT, pseudoState=null, deferred=[], entryActions=[], exitActions=[], stateActions=[], regions=[], submachine=null]], sources=null, targets=null, exception=null]
gmlc      | 2025-05-07 15:50:41,491 TRACE i.t.g.f.FSMListener:67 transition ended AbstractTransition [source=ObjectState [getIds()=[EMPTY], getClass()=class org.springframework.statemachine.state.ObjectState, hashCode()=1554953570, toString()=AbstractState [id=EMPTY, pseudoState=org.springframework.statemachine.state.DefaultPseudoState@7b03b388, deferred=[], entryActions=[], exitActions=[], stateActions=[], regions=[], submachine=null]], target=ObjectState [getIds()=[TRANSACTION_SENT], getClass()=class org.springframework.statemachine.state.ObjectState, hashCode()=1264200172, toString()=AbstractState [id=TRANSACTION_SENT, pseudoState=null, deferred=[], entryActions=[], exitActions=[], stateActions=[], regions=[], submachine=null]], kind=EXTERNAL, guard=org.springframework.statemachine.guard.Guards$$Lambda$1621/0x0000000801921ce0@74f166e4]
gmlc      | 2025-05-07 15:50:41,493 TRACE i.t.g.f.FSMListener:93 stateContext DefaultStateContext [stage=TRANSITION_END, message=GenericMessage [payload=EVENT_REQUEST, headers={id=b8d8de2d-7c78-c33e-e271-44185ad432e6, timestamp=1746625841269}], messageHeaders={id=b8d8de2d-7c78-c33e-e271-44185ad432e6, timestamp=1746625841269}, extendedState=DefaultExtendedState [variables={REQUEST_DATA=it.tykelab.gmlc.diameter.slg.model.ProvideLocationData@3c92c0e9[lcsPriority=0,msisdn=333910420708,dumpPcap=true,transactionId=PL_333910420708_20250507155040150]}], transition=AbstractTransition [source=ObjectState [getIds()=[EMPTY], getClass()=class org.springframework.statemachine.state.ObjectState, hashCode()=1554953570, toString()=AbstractState [id=EMPTY, pseudoState=org.springframework.statemachine.state.DefaultPseudoState@7b03b388, deferred=[], entryActions=[], exitActions=[], stateActions=[], regions=[], submachine=null]], target=ObjectState [getIds()=[TRANSACTION_SENT], getClass()=class org.springframework.statemachine.state.ObjectState, hashCode()=1264200172, toString()=AbstractState [id=TRANSACTION_SENT, pseudoState=null, deferred=[], entryActions=[], exitActions=[], stateActions=[], regions=[], submachine=null]], kind=EXTERNAL, guard=org.springframework.statemachine.guard.Guards$$Lambda$1621/0x0000000801921ce0@74f166e4], stateMachine=TRANSACTION_TIMEOUT TRANSACTION_FAILED TRANSACTION_SUCCESS TRANSACTION_SENT EMPTY  / TRANSACTION_SENT / uuid=40393951-193b-4324-af75-4757f0e7e489 / id=PL_333910420708_20250507155040150, source=null, target=null, sources=null, targets=null, exception=null]
gmlc      | 2025-05-07 15:50:41,514 DEBUG i.t.g.d.s.s.SlgAsyncService:93 tx[PL_333910420708_20250507155040150] sent [EVENT_REQUEST] completed false
gmlc      | 2025-05-07 15:50:41,591 TRACE i.t.g.d.s.l.SlgNetworkListener:45 ProvideLocationAnswerImpl com.mobius.software.telco.protocols.diameter.impl.commands.slg.ProvideLocationAnswerImpl@f0cad880
gmlc      | 2025-05-07 15:50:41,595 WARN  c.m.s.t.p.d.i.DiameterLinkImpl:607 An error occured while delivering incoming message CompositeByteBuf(ridx: 0, widx: 0, cap: 0, components=0).slice(328, 8) from Association [name=slg_link_1, associationType=CLIENT, ipChannelType=TCP, hostAddress=172.28.0.3, hostPort=3869, peerAddress=172.28.0.2, peerPort=4869, serverName=null, extraHostAddress=[]]
gmlc      | java.lang.IndexOutOfBoundsException: CompositeByteBuf(ridx: 0, widx: 0, cap: 0, components=0).slice(328, 8)
gmlc      |     at io.netty.buffer.AbstractUnpooledSlicedByteBuf.checkSliceOutOfBounds(AbstractUnpooledSlicedByteBuf.java:479)
gmlc      |     at io.netty.buffer.AbstractUnpooledSlicedByteBuf.<init>(AbstractUnpooledSlicedByteBuf.java:38)
gmlc      |     at io.netty.buffer.UnpooledSlicedByteBuf.<init>(UnpooledSlicedByteBuf.java:24)
gmlc      |     at io.netty.buffer.AbstractByteBuf.slice(AbstractByteBuf.java:1221)
gmlc      |     at io.netty.buffer.AbstractUnpooledSlicedByteBuf.slice(AbstractUnpooledSlicedByteBuf.java:235)
gmlc      |     at io.netty.buffer.AbstractByteBuf.slice(AbstractByteBuf.java:1210)
gmlc      |     at io.netty.buffer.Unpooled.wrappedBuffer(Unpooled.java:231)
gmlc      |     at com.mobius.software.telco.protocols.diameter.impl.primitives.DiameterOctetStringImpl.getValue(DiameterOctetStringImpl.java:87)
gmlc      |     at com.mobius.software.telco.protocols.diameter.impl.commands.slg.ProvideLocationAnswerImpl.getECGI(ProvideLocationAnswerImpl.java:206)
gmlc      |     at it.tykelab.gmlc.diameter.slg.listener.SlgNetworkListener.onMessage(SlgNetworkListener.java:49)
gmlc      |     at com.mobius.software.telco.protocols.diameter.impl.MessageProcessingTask.execute(MessageProcessingTask.java:602)
gmlc      |     at com.mobius.software.common.dal.timers.Worker.run(Worker.java:82)
gmlc      |     at java.base/java.util.concurrent.ThreadPoolExecutor.runWorker(ThreadPoolExecutor.java:1135)
gmlc      |     at java.base/java.util.concurrent.ThreadPoolExecutor$Worker.run(ThreadPoolExecutor.java:635)
gmlc      |     at java.base/java.lang.Thread.run(Thread.java:831)
```
